<?xml version="1.0" encoding="UTF-8"?>
<!DOCTYPE concurso SYSTEM "trabajodtd.dtd">
<concurso id="A01">
    <informacion>
      <sede>
        <direccion>Avenida de Galicia, 101, 36216 </direccion>
        <localidad>Vigo</localidad>
        <provincia>Pontevedra</provincia>
       </sede>
      <datos>
        <fechafin>Septiembre</fechafin>
        <edicion>Verano</edicion>
      </datos>
    </informacion>
    <participantes>
      <participacion cod = "EP022"> 
        <grupo nombre="El pshow" tipo="Rock-Rap">
            <integrante instrumento="Guitarra">
                <nombre>Gonzalo</nombre>
                <apellido>Gutierrez Otero</apellido>
                <dni>54785236J</dni>
            </integrante>
            <integrante instrumento="bateria">
                <nombre>Aron</nombre>
                <apellido>De Pedro Martinez</apellido>
                <dni>96535248W</dni>
            </integrante>
            <integrante> <!--vocal-->
                <nombre>David</nombre>
                <apellido>Carranque Rodriguez</apellido>
                <dni>54965874O</dni>
                <lider></lider>
            </integrante>
           </grupo>
      </participacion>
      <participacion cod="KM027">
        <solista>
          <integranteS instrumento="violin" tipo="clásica">
            <nombreS>Hector</nombreS>
            <apellidoS>Mascuñana Rodriguez</apellidoS>
            <dniS>54231414K</dniS>
            </integranteS>
          </solista>
      </participacion>
    </participantes>
    </concurso>
    